id,titel,tijd,datum,categorie
1,Strookrijk,77,2017-12-30,achtergrond
2,Nieuwe rotsdeur in steengoede darkride,31,2018-01-02,nieuws
3,Interview met Efteling-icoon Mari van Heumen,81,2018-01-08,interview
4,Dat souvenir interesseert me geen moer,65,2018-01-15,nieuws
5,Een storm in een glas Hertog Jan,55,2018-01-22,nieuws
6,Onze 10 favoriete plekken in het Efteling park,56,2018-01-29,achtergrond
7,Tips voor een dagje Efteling met kleine kinderen,73,2018-02-05,achtergrond
8,Ons Fons,94,2018-02-12,nieuws
9,Fotograferen in de Efteling met Kris van de Sande,56,2018-02-19,interview
10,Koffiedik kijken,63,2018-02-26,nieuws
11,Symbolica 8 maanden na opening,63,2018-03-05,achtergrond
12,Ontwerpbestemmingsplan Wereld van de Efteling 2030 (deel 1),74,2018-03-12,achtergrond
13,Ontwerpbestemmingsplan Wereld van de Efteling 2030 (deel 2),47,2018-03-19,achtergrond
14,Het Vrolijkste nieuws in decennia,63,2018-03-26,nieuws
15,Heropening python,59,2018-03-31,reportage
16,Er mist daar iets,70,2018-04-02,nieuws
17,Een kapbeitel overstemmen,75,2018-04-09,nieuws
18,Dromen over 2030,61,2018-04-16,achtergrond
19,Advocaat Wolf,62,2018-04-23,nieuws
20,Roversnest,60,2018-04-30,nieuws
21,t Verdiende Loon,15,2018-05-02,achtergrond
22,Liefde voor de Efteling,60,2018-05-07,achtergrond
23,Reacties van luisteraars,36,2018-05-10,nieuws
24,De Bezorgde Vegaburgers,98,2018-05-14,nieuws
25,Tips voor een regenachtige dag in de Efteling,42,2018-05-21,achtergrond
26,Fotografievragen voor Kris van de Sande,54,2018-05-28,interview
27,Onze favoriete Eftelingmuziek,96,2018-06-04,achtergrond
28,Storytelling met Philip Corsius,53,2018-06-11,achtergrond
29,Genoveva? Witte gij da?,121,2018-06-18,nieuws
30,Dode beelden stinken zo,73,2018-06-25,nieuws
31,Onderhoud in de Efteling,62,2018-07-02,achtergrond
32,Een roze hazmat suit,67,2018-07-09,nieuws
33,Onze wensen voor de Efteling,67,2018-07-16,achtergrond
34,GuestHouse Hotel,71,2018-07-19,reportage
35,Die is het achtbaanspoor bijster,82,2018-07-23,nieuws
36,Opening van de Vrolijke Noot,47,2018-07-26,reportage
37,Tips voor een warme dag in de Efteling,55,2018-07-30,achtergrond
38,Die mot je nie,69,2018-08-06,nieuws
39,Komt het nieuwe Reizenrijk er zo uit te zien...?,47,2018-08-07,achtergrond
40,Eten en drinken in de Efteling,86,2018-08-13,achtergrond
41,Avondboodschap,63,2018-08-16,reportage
42,Allez Tom Tom,86,2018-08-20,nieuws
43,Reacties van luisteraars,41,2018-08-22,achtergrond
44,Gerestaureerde Jezus-afbeelding in een kerk,85,2018-08-27,nieuws
45,Ons favoriete entertainment in de Efteling,76,2018-09-03,achtergrond
46,Seizoenen in de Efteling,75,2018-09-10,achtergrond
47,Het bestemmingsplandemonium,155,2018-09-17,nieuws
48,Première CARO,57,2018-09-19,reportage
49,Onze favoriete parken buiten de Efteling,81,2018-09-24,achtergrond
50,Een flesje kinderchampagne,86,2018-10-01,nieuws
51,Fata Morgana tijdens onderhoud,30,2018-10-04,reportage
52,Storytelling hoofdstuk 2 met Philip Corsius,60,2018-10-08,achtergrond
53,Ik wil niet dat m’n bossen een lunapark worden,101,2018-10-15,nieuws
54,Reacties van luisteraars,66,2018-10-22,achtergrond
55,Gegarandeerd bingo,60,2018-10-29,nieuws
56,Achtbanen top 6,81,2018-11-05,achtergrond
57,Die van Pardoes is groter,80,2018-11-12,nieuws
58,De toekomst van het Sprookjesbos,63,2018-11-19,achtergrond
59,Die benen hebben onderhoud nodig,108,2018-11-26,nieuws
60,"Wessel Wit over Looopings, Efteling en (fan)media",83,2018-12-03,interview
61,Animaltronics,106,2018-12-10,nieuws
62,Mario Dieltjes over het groen in de Efteling,59,2018-12-17,interview
63,Eftemal Kingdom,99,2018-12-24,nieuws
64,Tips voor een winters dagje Efteling,50,2018-12-31,achtergrond
65,Kabouterziektes,69,2019-01-07,nieuws
66,Reacties van luisteraars,42,2019-01-10,achtergrond
67,Marwin van de Hoeve over De Vijf Zintuigen,86,2019-01-14,interview
68,Sprookjesboom is door een Heras hekwerk heen gerend,93,2019-01-21,nieuws
69,Evenementideeën voor de Efteling,57,2019-01-28,achtergrond
70,Carnaval Restyle,55,2019-01-29,nieuws
71,Fantasievliegers,73,2019-02-04,nieuws
72,Een Efteling-plattegrond uit 1991,73,2019-02-11,achtergrond
73,Sprookjesboombroccoli,99,2019-02-14,nieuws
74,Studiotour bij René Merkelbach,57,2019-02-18,achtergrond
75,Grote Pardoes-sloffen,102,2019-02-25,nieuws
76,De Vijf Zintuigen Efteling Pubquiz 2019,38,2019-02-27,reportage
77,Uitspraak Raad van State voorlopige voorziening,21,2019-03-01,nieuws
78,Wat kunnen de Efteling en andere parken van elkaar leren,84,2019-03-04,achtergrond
79,Reacties van luisteraars,26,2019-03-07,achtergrond
80,Ik wil wel met jou in De Zweef,86,2019-03-11,nieuws
81,Onze top-7 sprookjes in het Sprookjesbos,59,2019-03-18,achtergrond
82,Een Doorn in het oog,105,2019-03-25,nieuws
83,Een ode aan Pandadroom en de schilderijen in het Carrouselpaleis,63,2019-04-01,achtergrond
84,Baron 1898,70,2019-04-08,achtergrond
85,Het wordt wel warm onder dat dekje,103,2019-04-15,nieuws
86,Een rondleiding over Parck Kaatsheuvel,17,2019-04-17,achtergrond
87,Efteling bordspellen,102,2019-04-22,achtergrond
88,De Efteling voor 1952 - Deel 1,103,2019-04-29,achtergrond
89,Die uitwerpselen zijn niet op schaal,116,2019-05-06,nieuws
90,De Efteling voor 1952 - Deel 2,85,2019-05-13,achtergrond
91,Goeie pijpenbuigers,100,2019-05-20,nieuws
92,Carnaval Festival heropening,43,2019-05-23,achtergrond
93,Reacties van luisteraars,58,2019-05-27,achtergrond
94,Ruud Bos documentaire making-of,66,2019-05-31,interview
95,Niet Efteling-Monkey Town,115,2019-06-03,nieuws
96,Tips voor een drukke dag in de Efteling,86,2019-06-10,achtergrond
97,Team Fata vs. Team Joris,86,2019-06-17,nieuws
98,Onze favoriete details in de Efteling,56,2019-06-24,achtergrond
99,Alsof ze curling aan het spelen waren,116,2019-07-01,nieuws
100,Kleine Boodschap 100,117,2019-07-08,interview
101,Nieuwe wisseltentoonstelling in het Efteling Museum,22,2019-07-10,reportage
102,Wolf tegen Lam,98,2019-07-15,nieuws
103,Reacties van luisteraars,42,2019-07-18,achtergrond
104,Meer fotografie in de Efteling met Kris Van de Sande,47,2019-07-22,interview
105,Jullie favoriete sprookjes (en reacties),28,2019-07-25,achtergrond
106,Een rondje door de Wereld van de Efteling,142,2019-07-29,achtergrond
107,Efteling-bieren,86,2019-08-05,achtergrond
108,"Twinkel, twinkel, yeah, yeah, yeah!",158,2019-08-12,nieuws
109,Hele kleine puntjes,52,2019-08-19,nieuws
110,Jullie favoriete details,34,2019-08-21,achtergrond
111,De mooiste gebouwen in de Efteling,67,2019-08-26,achtergrond
111,Watergate,86,2019-09-02,nieuws
113,Afscheid van de Bob,68,2019-09-04,reportage
114,De magie van Verticaal gaan,74,2019-09-09,achtergrond
115,Anton Koekblik,98,2019-09-16,nieuws
116,Niet-gerealiseerde Efteling-projecten (deel 1),86,2019-09-23,achtergrond
117,De opening van De zes Zwanen,74,2019-09-30,reportage
118,Tussen de bielzen en de zitkuil,121,2019-10-07,nieuws
119,Animatronics in de Efteling,78,2019-10-14,achtergrond
120,Winterballen,96,2019-10-21,nieuws
121,Niet-gerealiseerde Efteling-projecten (deel 2),68,2019-10-28,achtergrond
122,Max + Music,114,2019-11-04,nieuws
123,Efteling en duurzaamheid met Wyke Smit,65,2019-11-11,interview
124,Polles Worsten Imperium,110,2019-11-18,nieuws
125,Niet-gerealiseerde Efteling-projecten (deel 3),67,2019-11-25,achtergrond
126,De Uithongerige Machinist,105,2019-12-02,nieuws
127,De opening van Fabula,124,2019-12-09,reportage
128,Herauten Horror,101,2019-12-16,nieuws
129,Onze favoriete karakters in de Efteling,58,2019-12-23,achtergrond
130,Reacties van luisteraars,60,2019-12-25,achtergrond
131,Een ode aan het Waterorgel,87,2019-12-30,achtergrond
132,Hotel de Bottle,45,2020-01-01,achtergrond
133,Aldimatronics,127,2020-01-06,nieuws
134,De magie van het verzamelen,89,2020-01-13,achtergrond
135,Weet je wat er ook viral gaat?,77,2020-01-20,nieuws
136,Bosrijk audio-tour,59,2020-01-27,achtergrond
137,In gesprek met Erik van den Brand,59,2020-02-03,interview
138,Teer-aan-m’n-schoen,123,2020-02-10,nieuws
139,’t Loonsche Land audio-tour,49,2020-02-17,achtergrond
140,Een Halve Maen weg zitten peuzelen,102,2020-02-24,nieuws
141,In gesprek met Cees Kikstra,100,2020-03-02,interview
142,Hoeveelste was je nu geworden?,123,2020-03-09,nieuws
143,Max + Moritz bouwplaats-tour,56,2020-03-10,reportage
144,Klassieke muziek in de Efteling,69,2020-03-16,achtergrond
145,Coronaval Festival,101,2020-03-23,nieuws
146,Het Efteling Golfpark,72,2020-03-30,achtergrond
147,Jullie favoriete karakters in de Efteling,31,2020-04-01,achtergrond
148,Storm in plaswater,123,2020-04-06,nieuws
149,Pieckblauwe luchten,100,2020-04-13,achtergrond
150,Anderhalve meter ijs,130,2020-04-20,nieuws
151,Werken bij de Efteling,82,2020-04-27,nieuws
152,Corny Island,79,2020-05-04,nieuws
153,Reacties van luisteraars,57,2020-05-11,achtergrond
154,TjoepTjoep,141,2020-05-18,nieuws
155,Efteling boeken,153,2020-05-25,achtergrond
156,De Grote Heropeningsshow,166,2020-06-01,nieuws
157,Ouder en wijzer?,60,2020-06-08,achtergrond
158,Verstopte bestemmingen,138,2020-06-15,nieuws
159,Max & Moritz,113,2020-06-22,reportage
160,De vlieg is nog aan het winnen,117,2020-06-29,nieuws
161,Reacties van luisteraars,70,2020-07-06,achtergrond
162,IJskoffie klinkt spannender dan Drenthe,105,2020-07-13,nieuws
163,Onze masterplannen voor de Efteling,108,2020-07-20,achtergrond
164,Volgens mij was de LSD in de aanbieding,103,2020-07-27,nieuws
165,Jullie Pieckblauwe luchten,77,2020-08-03,achtergrond
166,Wat is écht Eftelings?,81,2020-08-10,achtergrond
167,Een ode aan het Diorama,70,2020-08-17,achtergrond
168,De geschiedenis van de Stoomcarrousel,75,2020-08-24,achtergrond
169,De raad der Dumbasses,139,2020-08-31,nieuws
170,Afscheid van Bart de Boer,44,2020-09-03,achtergrond
171,Efteling-tatoeages met Bram Elstak,50,2020-09-07,interview
172,Meesters van klefheid,88,2020-09-14,nieuws
173,Anton Pieck en het Anton Pieck museum,135,2020-09-21,interview
174,Paar kuub Piecks groen,129,2020-09-28,nieuws
175,De Glazen Bol,71,2020-10-05,achtergrond
176,Aquanura met een zachte G,72,2020-10-09,reportage
177,IJspegels in je bakkes,103,2020-10-12,nieuws
178,Nieuwsflitsbonusaflevering,35,2020-10-16,nieuws
179,Het Keienspoor met Ivo Südmeier,101,2020-10-19,achtergrond
180,Het Efteling Hotel,100,2020-10-26,achtergrond
181,Heb je last van stemproblemen?,163,2020-11-02,nieuws
182,De financiën van de Efteling (deel 1),146,2020-11-09,achtergrond
183,Kernsplijting in de fontein,101,2020-11-16,nieuws
184,Theme Park Science achter de schermen bij de Pagode,51,2020-11-18,achtergrond
185,In gesprek met Ronald van der Zijl,109,2020-11-23,interview
186,Genoeg lichtpuntjes om naar uit te kijken,125,2020-11-30,nieuws
187,Polka Marina,29,2020-12-01,achtergrond
188,De financiën van de Efteling (deel 2),163,2020-12-07,achtergrond
189,Ze lijken familie van Spider-Man,128,2020-12-14,nieuws
190,Villa Pardoes,122,2020-12-21,interview
191,Als warme muizen over de toonbank,96,2020-12-28,nieuws
192,Een plattegrond uit 1978,62,2021-01-04,achtergrond
193,En een aspirientje,90,2021-01-11,nieuws
194,De toiletten van de Efteling,98,2021-01-18,achtergrond
195,De wolkenkrabber van Vrouw Holle,108,2021-01-25,nieuws
196,Efteling en media (deel 1),137,2021-02-01,achtergrond
197,Jij bent de nuchtere,113,2021-02-08,nieuws
198,In gesprek met Reinoud van Assendelft de Coningh,156,2021-02-15,interview
199,Achter de schermen bij Kleine Boodschap,153,2021-02-17,achtergrond
200,"Om tafel met Efteling-ontwerpers Sander, Jeroen en Ronald",106,2021-02-22,interview
201,Bij een bruggetje heb je ook hout onder je,104,2021-03-01,nieuws
202,Wie is de Mol in de Efteling,86,2021-03-04,achtergrond
203,In gesprek met Pieter Cornelis,161,2021-03-08,interview
204,Opa Tim,91,2021-03-15,nieuws
205,Golfpark de Loonsche Duynen,60,2021-03-18,interview
206,Efteling en de fanmedia,94,2021-03-22,interview
207,Vertel dat maar aan de grootmoeder van Roodkapje,102,2021-03-29,nieuws
208,"Licht in de Efteling met Jaap, Stan en Eric",136,2021-04-05,interview
209,Een Sprookjesboom gaan slaan,124,2021-04-12,nieuws
210,Efteling en media (deel 2),137,2021-04-19,achtergrond
211,In gesprek met Jack Rijnen,114,2021-04-26,interview
212,Het centrum van m’n hele leven,130,2021-05-03,nieuws
213,Reacties van luisteraars,70,2021-05-10,achtergrond
214,Achter de schermen bij het Efteling Theater,110,2021-05-17,reportage
215,De Nog Grotere Heropeningsshow,172,2021-05-24,nieuws
216,Het Efteling Hotel na de renovatie,49,2021-05-27,achtergrond
217,Onze favoriete darkrides,114,2021-05-31,achtergrond
218,Speelbos Nest!,91,2021-06-03,reportage
219,We gaan naar Strookrijk toe!,142,2021-06-07,nieuws
220,In gesprek met Lex Lemmens (deel 1),131,2021-06-14,interview
221,Bedrijvige gezelligheid,129,2021-06-21,nieuws
222,Efteling Kids Radio met Arnoud en Mayoni,142,2021-06-28,interview
223,Een miezer van mayonaise,165,2021-07-05,nieuws
224,In gesprek met Lex Lemmens (deel 2),133,2021-07-12,interview
225,Botox kuurtje gone wrong,120,2021-07-19,nieuws
226,In gesprek met burgemeester Hanne van Aart,67,2021-07-26,interview
227,Sander de Bruijn over De Wereld van Sindbad,67,2021-07-29,interview
228,Staafjesparadijs,86,2021-08-02,nieuws
229,Mijmeren over de Efteling met Rob Janssen,97,2021-08-09,interview
230,De financiën van de Efteling in 2020,158,2021-08-16,achtergrond
231,Het bestemmingsplan met Wyke Smit en Ivo Südmeier,107,2021-08-23,interview
232,In gesprek met Pieter Cornelis (deel 2),145,2021-08-30,interview
233,In gesprek met Michel den Dulk,204,2021-09-06,interview
234,Draconiconnieomhoogkomen,163,2021-09-13,nieuws
235,De muziek van Caro,67,2021-09-20,interview
236,In levende lijven zien dat het je niks interesseert,109,2021-09-27,nieuws
237,De Glazen bol 2021,82,2021-10-04,achtergrond
238,Bij Walibi zouden ze zeggen “Festivalisation”,125,2021-10-11,nieuws
239,Dat ik een pretzel in m’n bek steken mag,98,2021-10-18,nieuws
240,In gesprek met Dennis Bots,146,2021-10-25,interview
241,Halloween in de Efteling,98,2021-11-01,achtergrond
242,Coronatest met de Kango,133,2021-11-08,nieuws
243,Lavenlaar audio-tour,140,2021-11-15,achtergrond
244,Mijn hart van steen,143,2021-11-22,nieuws
245,Onze favoriete beeldjes in de Efteling,62,2021-11-29,achtergrond
246,Het heelal mét tuinslang,142,2021-12-06,nieuws
247,Bäckerei Krümel,73,2021-12-08,reportage
248,In gesprek met Frans Goenee,105,2021-12-13,interview
249,Broodmager,131,2021-12-20,nieuws
250,Het Gildehuis,131,2021-12-27,reportage
251,The making of The Making of Fata Morgana,120,2021-12-29,interview
252,Aquanura met een Zachte G verbieden,123,2022-01-03,nieuws
253,Onze favoriete infill attracties,75,2022-01-10,achtergrond
254,Eclecticisme,101,2022-01-17,nieuws
255,Alles over Eftepedia,100,2022-01-24,interview
256,Een kuub haarspeldjes,163,2022-01-31,nieuws
257,De Wereld van Sindbad,49,2022-02-03,reportage
258,Aan tafel met Ton Merkx (deel 1),114,2022-02-07,interview
259,Alsof je bier in een vet glas schenkt,165,2022-02-14,nieuws
260,De verweven historie van Kaatsheuvel en de Efteling,193,2022-02-21,achtergrond
261,Bermpje,123,2022-02-28,nieuws
262,Taste of Europe,109,2022-03-02,interview
263,In gesprek met Frans Goenee (deel 2),131,2022-03-07,interview
264,VHS band op een brakke LCD-televisie,122,2022-03-14,nieuws
265,Mijmeren met Jerik van Nuenen,81,2022-03-21,interview
266,Bond voor de Vliegende Hollander,120,2022-03-28,nieuws
267,Efteling Wonderland,54,2022-03-30,reportage
268,Aan tafel met Ton Merkx (deel 2),110,2022-04-01,interview
269,Groot onderhoud bij de Pagode,59,2022-04-06,reportage
270,BN’er-kenner,126,2022-04-11,nieuws
271,Ik gun jou mijn eitjes,118,2022-04-18,nieuws
272,Een kijkje in de kas van de Efteling,79,2022-04-25,achtergrond
273,Wat missen we het meest uit de Efteling?,76,2022-05-02,achtergrond
274,Wat te doen buiten de Efteling,95,2022-05-09,achtergrond
275,There’s a rat in my ketting,173,2022-05-16,nieuws
276,We hebben ze voor het toiletblok gezet,132,2022-05-23,nieuws
277,In gesprek met Cees Sprangers,131,2022-05-30,interview
278,Lichtmasten met een identiteitscrisis,124,2022-06-06,nieuws
279,Onze favoriete plekken in de Efteling in het donker,57,2022-06-13,achtergrond
280,Nog hypedter,151,2022-06-20,nieuws
281,Onze favoriete Efteling-attracties,96,2022-06-27,achtergrond
282,Kleine Boodschap in het theater,129,2022-07-04,interview
283,Lekker zwemmen in de sprinklerkelder,149,2022-07-11,nieuws
284,De financiën van de Efteling in 2021,192,2022-07-18,achtergrond
285,De accomodaties in Bosrijk en ’t Loonsche Land,100,2022-07-25,achtergrond
286,Plassen op het kerkhof,139,2022-08-01,nieuws
287,In gesprek met Anja Klis,84,2022-08-08,interview
288,Onze favoriete bordjes in de Efteling,82,2022-08-15,achtergrond
289,De speeltuinen in de Efteling,111,2022-08-22,achtergrond
290,In gesprek met Koos de Graaf,132,2022-08-29,interview
291,Entrees en parkeerterreinen van de Efteling,103,2022-09-05,achtergrond
292,De sluiting van het Spookslot,78,2022-09-07,reportage
293,Een soort van Scooby-Doo aflevering,176,2022-09-12,nieuws
294,Thematisering in de Efteling met Martin en Patrick,121,2022-09-19,interview
295,Blausibel,128,2022-09-26,nieuws
296,De Glazen Bol 2022,70,2022-10-03,achtergrond
297,Peter Reijnders,92,2022-10-10,achtergrond
298,Gewoon de CO2-blusser erop,149,2022-10-17,nieuws
299,De oudste gebouwen in de Efteling,58,2022-10-24,achtergrond
300,Feestelijke reacties van luisteraars,114,2022-10-31,achtergrond
301,Het Textielmuseum en het Efteling tafellinnen,33,2022-11-02,achtergrond
302,Verticale verassing,172,2022-11-07,nieuws
303,Mijmeren met Sander Kesseler,93,2022-11-14,interview
304,Een rondje proefroken,137,2022-11-21,nieuws
305,De Efteling als verteller van sprookjes met Moniek Hover,162,2022-11-28,interview
306,Een kwakje spuitbeton,122,2022-12-05,nieuws
307,De boerderij aan de Horst,59,2022-12-12,interview
308,CARO en Sky Radio,112,2022-12-19,nieuws
309,In gesprek met Tim Nusselein,109,2022-12-26,interview
310,Hoodie Woodie,141,2023-01-02,nieuws
311,In gesprek met Sebastiaan Smits,97,2023-01-09,interview
312,Beunmeester Big,126,2023-01-16,nieuws
313,In gesprek met Bertus Kemmeren,66,2023-01-23,interview
314,In gesprek met Jordan Middleton (Cupcakes & Coasters),61,2023-01-26,interview
315,Direct na de dummies,116,2023-01-30,nieuws
316,De Efteling Stoomtrein Maatschappij,126,2023-02-06,interview
317,Team Erfgoedbeheer,86,2023-02-13,interview
318,Anarchie op de Europalaan,131,2023-02-20,nieuws
319,De muziek van de Wereld van Sindbad,75,2023-02-27,achtergrond
320,Efteling - De Tentoonstelling,76,2023-03-06,achtergrond
321,Mijn eerste hoop zal niet de laatste zijn,147,2023-03-13,nieuws
322,Efteling in Concert,81,2023-03-20,interview
323,We hebben goeie hoop,130,2023-03-27,nieuws
324,Efteling-personeelskleding met Loet Smits,113,2023-04-03,achtergrond
325,De Efteling achter de schermen,101,2023-04-10,achtergrond
326,Wishful sinking,138,2023-04-17,nieuws
327,Het vernieuwde Anton Pieckplein,79,2023-04-20,reportage
328,De Efteling als verteller van sprookjes met Moniek Hover (deel 2),166,2023-04-24,interview
329,In gesprek met Paul Beck,109,2023-05-01,interview
330,Ode aan het Spookslot,101,2023-05-08,achtergrond
331,Tot zover het toiletblok,149,2023-05-15,nieuws
332,Het Efteling Kostuumatelier,98,2023-05-22,interview
333,Koffie-abonnement,141,2023-05-29,nieuws
334,In gesprek met Goof Lukken,170,2023-06-05,interview
335,On fire op de Laetste Hoop,88,2023-06-12,nieuws
336,De financiën van de Efteling in 2022,155,2023-06-19,achtergrond
337,Extra zompige pannenkoeken,97,2023-06-26,nieuws
338,Bram van Binnendijk over Theo Hochwald,140,2023-07-03,interview
339,Onderhoud aan de Stoomcarrousel,27,2023-07-05,reportage
340,Friethoest,151,2023-07-10,nieuws
341,Frietje Blitzkrieg,106,2023-07-17,nieuws
342,Mijmeren met Domien Verschuuren,71,2023-07-24,interview
343,Onze favoriete ritsystemen,147,2023-07-31,achtergrond
344,Mijmeren met Job van Tol,148,2023-08-07,interview
345,Onze favoriete special effects in de Efteling,129,2023-08-14,achtergrond
346,Adieu Grand Circus Balancé,115,2023-08-21,achtergrond
347,Sneeuw in Droomvlucht,161,2023-08-28,nieuws
348,Mark Jansen over technisch ontwerp en duurzaamheid,90,2023-09-04,interview
349,Strijden tegen draken van vliegjes,110,2023-09-10,nieuws
350,In gesprek met Arijan van Bavel,134,2023-09-17,interview
351,Pieckwashing,104,2023-09-25,nieuws
352,Boekpresentatie Raveleijn - Het bloed van de laatste draak,104,2023-09-29,reportage
353,De Glazen Bol 2023,91,2023-10-02,achtergrond
354,Nek aan nek met een klittenbandje,88,2023-10-09,nieuws
355,Mijmeren met Xander de Rycke,101,2023-10-16,interview
356,Popcornverkooppunttekort,125,2023-10-23,nieuws
357,Efteling pins,177,2023-10-30,achtergrond
358,Een strobaal afdoen met een doekje,114,2023-11-06,nieuws
359,Mijmeren met Willem Sikkers,99,2023-11-13,interview
360,Champignons buiten knikkeren,116,2023-11-20,nieuws
361,Achter de schermen bij de Spookslot-documentaire van De Vijf Zintuigen,210,2023-11-26,interview
362,Gas(t)beleving,104,2023-12-04,nieuws
363,De restauratie van het kasteel van Doornroosje,51,2023-12-11,reportage
364,Als Shrek thuiskomen,111,2023-12-18,nieuws
365,De internationalisering van de Efteling,119,2023-12-22,achtergrond
366,Struikelblokken,112,2024-01-01,nieuws
367,In gesprek met Marjolein Mens,149,2024-01-08,interview
368,De Koningssuite en Droomvlucht Suite in het Efteling Hotel,17,2024-01-11,reportage
369,Suske & Wiske en de Varende Vissen,117,2024-01-14,nieuws
370,De muziek van Baron 1898,83,2024-01-22,achtergrond
371,Pieckvermogen,119,2024-01-29,nieuws
372,Het hoogste punt van Danse Macabre,35,2024-02-02,reportage
373,Mijmeren met Bart Baan en Niels Kooyman,168,2024-02-05,interview
374,De Legende van Familie Vos,106,2024-02-07,achtergrond
375,Witheet,128,2024-02-12,nieuws
376,In gesprek met Steven Grant,56,2024-02-19,interview
377,Meej glans van de schaans,124,2024-02-25,nieuws
378,Escapisme in de Efteling,121,2024-03-03,achtergrond
379,Smaakexplosie,109,2024-03-11,nieuws
380,Wat met de Winter Efteling?,138,2024-03-18,achtergrond
